{
  "$schema": "https://json-schema.org/draft/2020-12/schema",
  "$id": "urn:rvbench:baseline-results:1.0.0",
  "title": "rvbench historical baseline measurements v1",
  "$comment": "Historical evidence, not current pass state or incumbent registry. Validate with rvbench validate baseline-results.",
  "type": "object",
  "properties": {
    "$schema": {
      "type": "string",
      "pattern": "(^|/)baseline_results\\.schema\\.json$"
    },
    "schema_version": {
      "const": "1.0.0"
    },
    "purpose": {
      "enum": [
        "measured",
        "synthetic"
      ]
    },
    "suite_id": {
      "type": "string",
      "minLength": 1
    },
    "baseline_id": {
      "type": "string",
      "minLength": 1
    },
    "implementation_sha256": {
      "type": "string",
      "pattern": "^[a-f0-9]{64}$"
    },
    "environments": {
      "type": "array",
      "items": {
        "$ref": "#/$defs/environment"
      },
      "minItems": 1
    },
    "measurements": {
      "type": "array",
      "items": {
        "$ref": "#/$defs/measurement"
      },
      "minItems": 1
    }
  },
  "required": [
    "$schema",
    "schema_version",
    "purpose",
    "suite_id",
    "baseline_id",
    "implementation_sha256",
    "environments",
    "measurements"
  ],
  "additionalProperties": false,
  "$defs": {
    "environment": {
      "type": "object",
      "properties": {
        "id": {
          "type": "string",
          "minLength": 1
        },
        "fingerprint_sha256": {
          "type": "string",
          "pattern": "^[a-f0-9]{64}$"
        },
        "architecture": {
          "const": "rv64"
        },
        "worker_id": {
          "anyOf": [
            {
              "type": "string",
              "minLength": 1
            },
            {
              "type": "null"
            }
          ]
        },
        "boot_id": {
          "anyOf": [
            {
              "type": "string",
              "minLength": 1
            },
            {
              "type": "null"
            }
          ]
        },
        "cpu": {
          "type": "object",
          "properties": {
            "model": {
              "type": "string",
              "minLength": 1
            },
            "isa": {
              "type": "string",
              "minLength": 1
            },
            "logical_cpus": {
              "type": "integer",
              "minimum": 1
            },
            "affinity": {
              "type": "array",
              "items": {
                "type": "integer",
                "minimum": 0
              },
              "minItems": 1,
              "uniqueItems": true
            }
          },
          "required": [
            "model",
            "isa",
            "logical_cpus",
            "affinity"
          ],
          "additionalProperties": false
        },
        "runtime": {
          "type": "object",
          "properties": {
            "python": {
              "type": "string",
              "minLength": 1
            },
            "torch": {
              "type": "string",
              "minLength": 1
            },
            "triton": {
              "type": "string",
              "minLength": 1
            },
            "flag_gems": {
              "type": "string",
              "minLength": 1
            },
            "runner": {
              "type": "string",
              "minLength": 1
            },
            "adapter": {
              "type": "string",
              "minLength": 1
            },
            "generator": {
              "type": "string",
              "minLength": 1
            }
          },
          "required": [
            "python",
            "torch",
            "triton",
            "flag_gems",
            "runner",
            "adapter",
            "generator"
          ],
          "additionalProperties": false
        },
        "isolation": {
          "type": "object",
          "properties": {
            "kind": {
              "enum": [
                "host_lock",
                "container"
              ]
            },
            "description": {
              "type": "string",
              "minLength": 1
            }
          },
          "required": [
            "kind",
            "description"
          ],
          "additionalProperties": false
        },
        "backend": {
          "type": "string",
          "minLength": 1
        },
        "host_tag": {
          "type": "string",
          "minLength": 1
        },
        "omp_threads": {
          "type": "integer",
          "minimum": 1
        }
      },
      "required": [
        "id",
        "fingerprint_sha256",
        "architecture",
        "worker_id",
        "boot_id",
        "cpu",
        "runtime",
        "isolation",
        "backend",
        "host_tag",
        "omp_threads"
      ],
      "additionalProperties": false
    },
    "input": {
      "type": "object",
      "properties": {
        "name": {
          "type": "string",
          "minLength": 1
        },
        "kind": {
          "enum": [
            "tensor",
            "none"
          ]
        },
        "shape": {
          "anyOf": [
            {
              "type": "array",
              "items": {
                "type": "integer",
                "minimum": 0
              },
              "minItems": 0
            },
            {
              "type": "null"
            }
          ]
        },
        "dtype": {
          "anyOf": [
            {
              "type": "string",
              "minLength": 1
            },
            {
              "type": "null"
            }
          ]
        },
        "strides": {
          "anyOf": [
            {
              "type": "array",
              "items": {
                "type": "integer",
                "minimum": 0
              },
              "minItems": 0
            },
            {
              "type": "null"
            }
          ]
        },
        "content_sha256": {
          "anyOf": [
            {
              "type": "string",
              "pattern": "^[a-f0-9]{64}$"
            },
            {
              "type": "null"
            }
          ]
        },
        "generator": {
          "anyOf": [
            {
              "type": "object"
            },
            {
              "type": "null"
            }
          ]
        },
        "storage_offset": {
          "anyOf": [
            {
              "type": "integer",
              "minimum": 0
            },
            {
              "type": "null"
            }
          ]
        }
      },
      "required": [
        "name",
        "kind",
        "shape",
        "dtype",
        "strides",
        "content_sha256",
        "generator",
        "storage_offset"
      ],
      "additionalProperties": false
    },
    "check": {
      "type": "object",
      "properties": {
        "id": {
          "type": "string",
          "minLength": 1
        },
        "kind": {
          "enum": [
            "numeric",
            "semantic",
            "execution"
          ]
        },
        "outputs": {
          "type": "array",
          "items": {
            "type": "string",
            "minLength": 1
          },
          "minItems": 0,
          "uniqueItems": true
        },
        "status": {
          "enum": [
            "passed",
            "failed",
            "unverifiable"
          ]
        },
        "reason": {
          "$ref": "#/$defs/reason"
        },
        "metrics": {
          "type": "object",
          "additionalProperties": {
            "anyOf": [
              {
                "type": "number"
              },
              {
                "type": "null"
              }
            ]
          }
        },
        "method": {
          "type": "string",
          "minLength": 1
        },
        "contract_sha256": {
          "anyOf": [
            {
              "type": "string",
              "pattern": "^[a-f0-9]{64}$"
            },
            {
              "type": "null"
            }
          ]
        },
        "parameters": {
          "type": "object"
        }
      },
      "required": [
        "id",
        "kind",
        "outputs",
        "status",
        "reason",
        "metrics",
        "method",
        "contract_sha256",
        "parameters"
      ],
      "additionalProperties": false
    },
    "artifact": {
      "type": "object",
      "properties": {
        "path": {
          "type": "string",
          "minLength": 1
        },
        "sha256": {
          "type": "string",
          "pattern": "^[a-f0-9]{64}$"
        },
        "size_bytes": {
          "type": "integer",
          "minimum": 0
        }
      },
      "required": [
        "path",
        "sha256",
        "size_bytes"
      ],
      "additionalProperties": false
    },
    "reason": {
      "anyOf": [
        {
          "type": "object",
          "properties": {
            "code": {
              "type": "string",
              "minLength": 1
            },
            "message": {
              "type": "string",
              "minLength": 1
            }
          },
          "required": [
            "code",
            "message"
          ],
          "additionalProperties": false
        },
        {
          "type": "null"
        }
      ]
    },
    "measurement": {
      "type": "object",
      "properties": {
        "case_id": {
          "type": "string",
          "minLength": 1
        },
        "case_contract_sha256": {
          "type": "string",
          "pattern": "^[a-f0-9]{64}$"
        },
        "inputs_sha256": {
          "type": "string",
          "pattern": "^[a-f0-9]{64}$"
        },
        "inputs": {
          "type": "array",
          "items": {
            "$ref": "#/$defs/input"
          },
          "minItems": 1
        },
        "attrs": {
          "type": "object"
        },
        "environment_id": {
          "type": "string",
          "minLength": 1
        },
        "recorded_at": {
          "type": "string",
          "format": "date-time",
          "pattern": "^\\d{4}-\\d{2}-\\d{2}T\\d{2}:\\d{2}:\\d{2}(?:\\.\\d+)?Z$"
        },
        "correctness": {
          "type": "object",
          "properties": {
            "status": {
              "enum": [
                "passed",
                "failed",
                "unverifiable"
              ]
            },
            "reason": {
              "anyOf": [
                {
                  "$ref": "#/$defs/reason"
                },
                {
                  "type": "null"
                }
              ]
            },
            "checks": {
              "type": "array",
              "items": {
                "$ref": "#/$defs/check"
              },
              "minItems": 0
            }
          },
          "required": [
            "status",
            "reason",
            "checks"
          ],
          "additionalProperties": false
        },
        "timing": {
          "anyOf": [
            {
              "type": "object",
              "properties": {
                "unit": {
                  "const": "ms"
                },
                "scope": {
                  "const": "call"
                },
                "statistic": {
                  "const": "median"
                },
                "preparation": {
                  "const": "excluded"
                },
                "synchronization": {
                  "type": "string",
                  "minLength": 1
                },
                "timing_contract_sha256": {
                  "type": "string",
                  "pattern": "^[a-f0-9]{64}$"
                },
                "warmup": {
                  "type": "integer",
                  "minimum": 0
                },
                "repetitions": {
                  "type": "integer",
                  "minimum": 1
                },
                "samples_ms": {
                  "type": "array",
                  "items": {
                    "type": "number",
                    "minimum": 0
                  },
                  "minItems": 1
                },
                "median_ms": {
                  "type": "number",
                  "minimum": 0
                }
              },
              "required": [
                "unit",
                "scope",
                "statistic",
                "preparation",
                "synchronization",
                "timing_contract_sha256",
                "warmup",
                "repetitions",
                "samples_ms",
                "median_ms"
              ],
              "additionalProperties": false
            },
            {
              "type": "null"
            }
          ]
        },
        "artifacts": {
          "type": "array",
          "items": {
            "$ref": "#/$defs/artifact"
          },
          "minItems": 0
        }
      },
      "required": [
        "case_id",
        "case_contract_sha256",
        "inputs_sha256",
        "inputs",
        "attrs",
        "environment_id",
        "recorded_at",
        "correctness",
        "timing",
        "artifacts"
      ],
      "additionalProperties": false
    }
  }
}
